Code,Title,Credits,Grading,Semesters Offered,Prerequisites,Corequisites,Crosslisted,Distribution Category,Breadth Requirement,Forbidden Overlap,Description
AEM 1200,Introduction to Business Management,3,Graded,"Spring, summer",,,AEM 1201,,,,"Provides an overview of management and business. Human resource, marketing, finance, and strategy concerns are addressed with consideration paid to current issues such as technological innovation and its impact on operations, globalization, ethics, teamwork, leadership, and entrepreneurship. Opportunity to deliver an integrative group project"
AEM 1201,Business Management,3,Graded,Summer,,,AEM 1200,,,,"Provides an overview of management and business. Human resource, marketing, finance, and strategy concerns are addressed with consideration paid to current issues such as technological innovation and its impact on operations, globalization, ethics, teamwork, leadership, and entrepreneurship. Opportunity to deliver an integrative group project"
AEM 2010,Spreadsheet Modeling for Management and Economics,3,Graded,"Fall, spring",,,,,,,"This course will be developed as a data-driven, model-based approach to decision-making. Most applications will rely on the standard array of Excel functionality but other platforms (e.g., Access, SQL, presentation software) may be employed. A unique feature of this course will be applications drawn from the diverse program areas of the Dyson School: management; international development/trade; environment/resource economics; and food/agricultural economics. Case material will be contributed by the companies from the DUAC. Key topics will include: Optimization (Solver), Data graphing, Financial modeling, Ethical/social dimensions of IT, Forecasting, Pivot tables, Exponential smoothing, and Simulation"
AEM 2210,Financial Accounting,3,Graded,"Fall, spring, summer",,,,,,"s: AEM 2225, HADM 1210, HADM 2230","Comprehensive introduction to financial accounting concepts and techniques, intended to provide a basic understanding of the accounting cycle, elements of financial statements, underlying theory of GAAP, and financial statement interpretation. Topics include methods of recording inventory, receivables, depreciation, bonds, and equity. Requires two evening prelims and a comprehensive final; weekly homework assignments"
AEM 2400,Marketing,3,Stdnt Opt,"Fall, summer",,,,,,,"Provides a broad introduction to the fundamentals of marketing. Explores the components of an organization's strategic marketing program, including how to price, promote, and distribute goods and services. Industry guest lectures and current marketing applications from various companies are presented and analyzed"
AEM 3230,Managerial Accounting,3,Graded,"Winter, spring, summer",AEM 2210 or equivalent,,,,,,"Introduction to cost accounting emphasizing the application of accounting concepts to managerial control and decision making. Major topics include product costing, standard costing, cost behavior, cost allocation, budgeting, variance analysis, and accounting systems in the manufacturing environment. Requires use of electronic spreadsheets. Includes an evening prelim, a second exam, and weekly homework"
AEM 3380,"Social Entrepreneurs, Innovators, and Problem Solvers",3,Stdnt Opt,"Fall, summer",,,,(SBA),,,"Introduces students to the social entrepreneurs, innovators, and visionaries who are creating new strategies for solving society's problems. The course highlights innovative case studies of success in restoring the environment, resolving conflicts, curing diseases, overcoming poverty, and addressing other problems of social injustice. At the end of the course, each student develops an original blueprint for social innovation: a creative proposal for solving a societal problem"
AEM 4940,Undergraduate Special Topics in Applied Economics and Management,3,Stdnt Opt,Fall or spring,,,,,,,"The department teaches ""trial"" courses under this number. Offerings vary by semester and are advertised by the department before the beginning of the semester"
AEM 4960,Applied Economics and Management Internship,1,Sat/Unsat,"Fall, spring",,,,,,,Evaluation of internship experience requiring the following written submission at the end of the term. 1) Internship job description and copies of training materials provided. 2) Weekly diary including descriptions of job responsibilities and reflections/insights on those experiences. 3) Three to five page paper reflecting on how the internship related to the academic program. All internships must be approved by the internship coordinator before the work experience segment
ALS 1140,Explorations in Biology Research and Health Professions,1,Graded,Summer,,,,,,,"Explores biology as it pertains to research, health-care professions, and the world at large. This seminar is designed for students with a strong interest in medicine and biological research. Discussions and laboratory exercises allow students to interact with faculty and guest speakers. Students learn to read and evaluate scientific publications on current biological topics. Course grade is based on several short papers"
ALS 2100,Teams and Leaders in Action,3,Graded,Summer,,,,(KCM) (SBA),,,"What do effective leaders do? How do they think? How do they overcome challenges? How does your personality affect your ability to lead, and how can you use aspects of your personality to help others and yourself? This course examines the habits of thought and practice of exceptional leaders, past and present, to equip the student to lead in an increasingly complex, connected, and diverse world. The course consists of nearly equal parts theory, philosophy, practice, and historical case study. Lessons learned from historical case studies are matched with contemporary leadership theory and practice from the business world, the military, athletics, journalism, and space exploration. The primary course objective is to produce future leaders prepared to influence their communities in positive ways, regardless of profession"
ALS 4960,Internship in Agriculture and Life Sciences,2,Sat/Unsat,"Fall, spring, summer",,,,,,,All 4960 internship courses must adhere to the CALS guidelines at cals.cornell.edu/academics/student-research/internship. Students planning internships related to the discipline of a department are encouraged to enroll in the departmental internship course
ALS 4970,Independent Study in Agriculture and Life Sciences,1-6,Stdnt Opt,"Fall, spring",,,,,,,No description available
AMST 2020,"Popular Culture in the United States, 1950 to the Present",4,Stdnt Opt,Spring,,,,(HA-AS),,,"AMST 2020 treats the period from 1950 to the present as we examine best-sellers, films, sports and television, radio, ads, newspapers, magazines, and music. We try to better understand the ways in which popular culture shapes and/or reflects American values. The course also depicts popular culture as ""contested terrain,"" the place where social classes, racial and ethnic groups, women and men, the powerful and less powerful seek to ""control"" images and themes. Topics include The Honeymooners and 1950s television, soap operas; ""gross-out"" movies; Elvis; the Beatles, and Guns 'n Roses; gothic romances; and People Magazine and USA Today"
AMST 3128,America's Changing Faces,2,Stdnt Opt,Summer,,,GOVT 3128,,,,"A new generation of leaders has emerged in America's political, economic, educational, and cultural institutions. Those leaders employ and explore in their work modern communications technologies such as the Internet. Thereby, they are changing both what is done and how things are done in the respective life spheres. This course explores the resulting changes in the nature of American life and asks questions about the interactions among the different realms of life"
AMST 3141,Prisons,4,Stdnt Opt,"Fall, winter, summer",,,GOVT 3141,(SBA-AS),,,"The United States stands alone among Western, industrialized countries with its persistent, high rates of incarceration, long sentences, and continued use of the death penalty. This ""American exceptionalism"" -- the turn to mass incarceration -- has been fostered by the use of sharply-delineated categories that define vast numbers of people as outlaws and others as law-abiding. Our purpose in this course is to understand how social and political actors have utitlized ideas that have deep roots in American political thought (ideas about rights, race, and responsibility) in ways that have now come to define large groups of the population as 'carcerable.'"
AMST 4696,The Art Market,4,Graded,Summer,,,"AMST 6696, ARTH 4696, ARTH 6696, VISST 4696",(LA-AS),,,"This course will examine the history of the art market, from the 16th century to the present. We will study the production, sale and exchange of works of art as well as the patrons, artists and collectors who participate in this economic, social and political form of taste-making and aesthetic valuation. Students will learn about noted patrons of the arts, such as the Medici family in Renaissance Italy, our main focus will be on the creation of a global art market in the twentieth century. Using case studies, sample topics include: patterns of transportation, exchange and trade; the interaction of collectors, critics and curators; the spaces and contexts of display of contemporary collections; auction houses and commercial galleries; and fakes, forgeries, thefts and scandals. Special attention will be paid to considering the contemporary art market (post 1980) and the collecting, exchange and valuation of film, photography, painting, performance and installation art. Global markets for the exchange of art in Asia, Europe, Africa, North America and South America will be highlighted as well as the exhibitions of contemporary art such as the Art Basel, the Cairo Biennale and the Venice Biennale that fuel these markets"
AMST 6696,The Art Market,4,Graded,Summer,,,"AMST 4696, ARTH 4696, ARTH 6696, VISST 4696",,,,"This course will examine the history of the art market, from the 16th century to the present. We will study the production, sale and exchange of works of art as well as the patrons, artists and collectors who participate in this economic, social and political form of taste-making and aesthetic valuation. Students will learn about noted patrons of the arts, such as the Medici family in Renaissance Italy, our main focus will be on the creation of a global art market in the twentieth century. Using case studies, sample topics include: patterns of transportation, exchange and trade; the interaction of collectors, critics and curators; the spaces and contexts of display of contemporary collections; auction houses and commercial galleries; and fakes, forgeries, thefts and scandals. Special attention will be paid to considering the contemporary art market (post 1980) and the collecting, exchange and valuation of film, photography, painting, performance and installation art. Global markets for the exchange of art in Asia, Europe, Africa, North America and South America will be highlighted as well as the exhibitions of contemporary art such as the Art Basel, the Cairo Biennale and the Venice Biennale that fuel these markets"
ANSC 1120,Sustainable Animal Husbandry,3,Stdnt Opt,Summer,,,,,,,"Students completing this course will understand the many roles of domestic animals and the importance of their interdependence with humans; appreciate the scope, diversity, and problems related to domestic animal systems; be able to design and operate simple sustainable animal systems; and know how to continue learning about sustainable animal systems. This intensive summer course includes 25 hours of lecture and 39 hours of hands-on laboratory/ demonstrations at various field sites and facilities all within a three-week period. Topics include domestication, sustainability, dogs, cats, rabbits, sheep, genetics, swine, nutrition, beef cattle, grazing, dairy cattle, dairy products, goats, poultry, aquaculture, camelids, horses, draft animals, animal systems modeling, Third World limited-resource animal systems, toxicology, lab animals, toxicology, veterinary medicine, and ethics of human interactions with domestic animals"
ANSC 2140,"Raptor Natural History, Conservation, and Captive Management",3,Graded,Summer,high school chemistry and biology,,,,,,"Introduction to the natural history and the care and management of raptors (birds of prey). Approaches to captive care and maintenance, restraint, training, and captive breeding with potential for reducing pressures on wild populations of avian species are included. A major objective is to present and discuss the scientific basis and merit of avian husbandry and breeding practices in species relevant to the course. Hands-on opportunities in basic raptor handling techniques are included"
ANSC 4990,Undergraduate Research in Animal Science,1-6,Stdnt Opt,"Fall, spring",GPA of at least 2.7,,,,,,"Affords opportunities for students to carry out independent research under appropriate supervision. Each student is expected to review pertinent literature, prepare a project outline, conduct the research, and prepare a report"
ANTHR 1300,"Human Evolution: Genes, Behavior, and the Fossil Record",3,Stdnt Opt,Spring,,,,(PBS Supplementary List),,,"The evolution of humankind is explored through the fossil record, studies of the biological differences among current human populations, and a comparison with our closest relatives, the primates. This course investigates the roots of human biology and behavior with an evolutionary framework"
ANTHR 2496,The Anthropology and History of the Food You Eat,3,Stdnt Opt,Winter,,,ANTHR 4496,,,,"Students in this on-line course will discuss readings on the history and anthropology of the development of the global food system while at the same time document and examine their own food habits. The course will present case studies from Mexico, Peru, India, Africa, as well as from the United States so that students delve into the history and extent of corporate control of food production while they buy and consume food, and document and analyze their diet"
ANTHR 3305,Anthropology of Parenting,4,Stdnt Opt,,,,,,,,No description available
ANTHR 3415,Art in the Modern World,4,Stdnt Opt,Summer,,,ARTH 3915,(CA-AS),,,"This course offers students an opportunity to learn from the visual and performing arts by attending music, theatre, and dance performances, and visiting museums and galleries. The program is open to any student interested in developing a feeling for different forms of expressive art. We examine how artistic expression introduces values that correspond to socially construed notions of color, sensation, ritual, and tradition"
ANTHR 4496,The Anthropology and History of the Food You Eat,3,Stdnt Opt,Winter,,,ANTHR 2496,,,,"Students in this on-line course will discuss readings on the history and anthropology of the development of the global food system while at the same time document and examine their own food habits. The course will present case studies from Mexico, Peru, India, Africa, as well as from the United States so that students delve into the history and extent of corporate control of food production while they buy and consume food, and document and analyze their diet"
ARCH 1110,Introduction to Architecture: Design Studio,3,Stdnt Opt,Summer,,,,,,,"Designed to introduce students to ideas, principles, and methods of solving architectural problems in a studio setting. Through a graduated sequence of exercises culminating in a major semester project, students explore the architectural concepts of space, form, function, and technology. Instruction is via highly personalized critiques of individual student work by assigned department faculty members, as well as periodic reviews of the group by invited faculty and guest critics. The grade is based on the overall performance in the studio with special emphasis on the quality of a major studio project"
ARCH 1300,An Introduction to Architecture: Lectures,3,Stdnt Opt,Summer,,,,,,,"Survey course that covers the many facets of architecture: history, design principles, preservations, landscape architecture, building technology, and cultural factors. Course format comprises lectures, demonstrations, films, and field trips. Evaluation is based on quizzes and a final exam"
ARCH 2100,Elective Design Studio,6,Graded,"Fall, spring, or summer",,,"ARCH 2101, ARCH 3100, ARCH 3101, ARCH 3102, ARCH 4100, ARCH 4101, ARCH 4102, ARCH 5100, ARCH 5101, ARCH 5104",,,,Non sequence design studio for students who are not architecture majors at Cornell and for department students taking design studio for non-sequence credit
ARCH 2101,Design III,6,Graded,"Fall, spring",,,"ARCH 2100, ARCH 3100, ARCH 3101, ARCH 3102, ARCH 4100, ARCH 4101, ARCH 4102, ARCH 5100, ARCH 5101, ARCH 5104",,,,"Students develop an understanding of context and precedent in the construction of architectural form, and are introduced to contextual and programmatic densities in addition to circulatory, spatial, and organizational strategies in the design process"
ARCH 3100,Elective Design Studio,6,Graded,"Fall, spring, or summer",,,"ARCH 2100, ARCH 2101, ARCH 3101, ARCH 3102, ARCH 4100, ARCH 4101, ARCH 4102, ARCH 5100, ARCH 5101, ARCH 5104",,,,Non sequence design studio for students who are not architecture majors at Cornell and for department students taking design studio for non-sequence credit
ARCH 3101,Design V,6,Graded,"Fall, spring",,,"ARCH 2100, ARCH 2101, ARCH 3100, ARCH 3102, ARCH 4100, ARCH 4101, ARCH 4102, ARCH 5100, ARCH 5101, ARCH 5104",,,,"Design and development of complex architectural projects situated in urban contexts and developed with regard to program, site, building, and representation"
ARCH 3102,Design VI,6,Graded,"Fall, spring",,,"ARCH 2100, ARCH 2101, ARCH 3100, ARCH 3101, ARCH 4100, ARCH 4101, ARCH 4102, ARCH 5100, ARCH 5101, ARCH 5104",,,,"Design and development of complex architectural projects situated in urban contexts and developed with regard to program, site, building, and representation"
ARCH 4100,Elective Design Studio,6,Graded,"Fall, spring, or summer",,,"ARCH 2100, ARCH 2101, ARCH 3100, ARCH 3101, ARCH 3102, ARCH 4101, ARCH 4102, ARCH 5100, ARCH 5101, ARCH 5104",,,,Non sequence design studio for students who are not architecture majors at Cornell and for department students taking design studio for non-sequence credit
ARCH 4101,Design VII,6,Graded,"Fall, spring",ARCH 3102,,"ARCH 2100, ARCH 2101, ARCH 3100, ARCH 3101, ARCH 3102, ARCH 4100, ARCH 4102, ARCH 5100, ARCH 5101, ARCH 5104",,,,"Advanced programs in architectural design, with options in, but not limited to, urban design, architectural technology, computational design, ecology, culture, and representation"
ARCH 4102,Design VIII,6,Graded,"Fall, spring",ARCH 4101,,"ARCH 2100, ARCH 2101, ARCH 3100, ARCH 3101, ARCH 3102, ARCH 4100, ARCH 4101, ARCH 5100, ARCH 5101, ARCH 5104",,,,"Advanced programs in architectural design, with options including, but not limited to, urban design, architectural technology, computational design, ecology, culture, and representation"
ARCH 5100,Elective Design Studio,6,Graded,"Fall, spring, summer",,,"ARCH 2100, ARCH 2101, ARCH 3100, ARCH 3101, ARCH 3102, ARCH 4100, ARCH 4101, ARCH 4102, ARCH 5101, ARCH 5104",,,,Non sequence design studio for students who are not architecture majors at Cornell and for department students taking design studio for non-sequence credit
ARCH 5101,Design IX,6,Graded,Fall or spring,ARCH 4102,,"ARCH 2100, ARCH 2101, ARCH 3100, ARCH 3101, ARCH 3102, ARCH 4100, ARCH 4101, ARCH 4102, ARCH 5100, ARCH 5104",,,,"Advanced programs in architectural design, with options in, but not limited to, urban design, architectural technology, computational design, ecology, culture, and representation"
ARCH 5104,Design Xa,6,Graded,"Fall, spring, or summer",Nonadvancing grade in ARCH 5902,,"ARCH 2100, ARCH 2101, ARCH 3100, ARCH 3101, ARCH 3102, ARCH 4100, ARCH 4101, ARCH 4102, ARCH 5100, ARCH 5101",,,,A structured studio for those needing to take an alternative to design thesis. This course operates within one of advanced option design studios
ARCH 6110,Graduate Design Seminar,3,Graded,Summer,,,,,,,No description available
ARCH 6301,Design Research,3,Graded,Summer,,,,,,,"Introduction to themes of inquiry in contemporary architecture, including critical motives in research, topical "" problems,"" and materials and tactics of investigation"
ARCH 7111,Design A,6,Graded,Summer,,,,,,,"Exploration of themes, methods, and technologies in contemporary design"
ART 1101,Art as Experience,3,Graded,Summer. (Three-week session),,,,,,,"Art as Experience is an introductory course that expands a student's understanding of the ideas and practices of art today. Studio projects will introduce a broad range of mediums from drawing and collage to digital photography and video installation. Students will explore and respond to resources at Cornell University and the course will be supplemented with readings, critiques and field trips.  The course will culminate in an exhibition where students will be responsible for the organization and installation of self-directed art work"
ART 1500,Summer Drawing I,3,Graded,Summer. (Three-week session),,,,,,,"General course introduces students to principles and techniques of representation. Emphasis is on creating the illusion of space and form through line, the rendering of light and shade, and studies in perspective. Students have the opportunity to explore various media such as charcoal, chalk, pencil, pen, ink, and wash"
ART 1503,Summer Drawing II,3,Stdnt Opt,Summer. (Three-week session),,,,,,,"General course in drawing that emphasizes figure study and life drawing. Builds on the foundation of ART 1500 and concentrates on the analytical study of the figure. Students explore a variety of materials, traditional and contemporary"
ART 2201,Painting: Introduction to Painting,4,Stdnt Opt,"Fall, spring, summer",,,,,,,"Studies the language of painting through color, form, materials, and techniques. Aspects of traditional and modern pictorial composition are studied including proportion, space, and color theory through the representation of a variety of subjects"
ART 2401,Introduction to Sculpture,4,Stdnt Opt,"Fall, spring, summer",,,,,,,This course introduces students to artistic practice in three dimensions using a variety of materials and approaches. Problems require the student to address materials in terms of cultural and historical context. Assumes no prior knowledge of sculpture
ART 2701,Digital Media: Introduction to Digital Media,4,Stdnt Opt,"Fall, spring",,,,,,,"This course explores the use of digital technology in contemporary art making. Students approach software programs by researching historical and contemporary art issues, with emphasis on how to differentiate between analog and digital forms. Through the investigation of the history of digital technology students will gain an understanding of digital culture and its correlation to social, aesthetic and theoretical issues. Topics explored include time-based art, network culture, image resolution, computational techniques, virtuality, and interactivity"
ART 3092,Independent Studio in Art,1-4,Stdnt Opt,"Fall, spring, summer",,,,,,,Independent studio allows a student the opportunity to investigate special interests that are not treated in regularly scheduled courses. The student develops a plan of study to pursue under the supervision of a faculty member
ART 3699,Photography: Special Topics,4,Graded,Fall or spring,ART 2601 or permission of instructor,,,,,,Topics TBA
ARTH 3915,Art in the Modern World,4,Stdnt Opt,Summer,,,ANTHR 3415,(CA-AS),,,"This course offers students an opportunity to learn from the visual and performing arts by attending music, theatre, and dance performances, and visiting museums and galleries. The program is open to any student interested in developing a feeling for different forms of expressive art. We examine how artistic expression introduces values that correspond to socially construed notions of color, sensation, ritual, and tradition"
ARTH 4696,The Art Market,4,Graded,Summer,,,"AMST 4696, AMST 6696, ARTH 6696, VISST 4696",(LA-AS),,,"This course will examine the history of the art market, from the 16th century to the present. We will study the production, sale and exchange of works of art as well as the patrons, artists and collectors who participate in this economic, social and political form of taste-making and aesthetic valuation. Students will learn about noted patrons of the arts, such as the Medici family in Renaissance Italy, our main focus will be on the creation of a global art market in the twentieth century. Using case studies, sample topics include: patterns of transportation, exchange and trade; the interaction of collectors, critics and curators; the spaces and contexts of display of contemporary collections; auction houses and commercial galleries; and fakes, forgeries, thefts and scandals. Special attention will be paid to considering the contemporary art market (post 1980) and the collecting, exchange and valuation of film, photography, painting, performance and installation art. Global markets for the exchange of art in Asia, Europe, Africa, North America and South America will be highlighted as well as the exhibitions of contemporary art such as the Art Basel, the Cairo Biennale and the Venice Biennale that fuel these markets"
