Code,Title,Credits,Grading,Semesters Offered,Prerequisites,Corequisites,Crosslisted,Distribution Category,Breadth Requirement,Forbidden Overlap,Description
SOC 1101,Introduction to Sociology,3,Stdnt Opt,"Fall, spring, summer",,,,(SBA-AS),,Students may not receive credit for both SOC 1101 and DSOC 1101,"This course introduces classical and contemporary sociological perspectives.  We will begin by considering (mainly classical) perspectives which focus on macro-level features of society (e.g., population, the economy) and the sweeping changes that have occurred within them over the past couple of centuries.  Particular attention will be paid to changes in social cohesion, the division of labor, the spatial organization of society, and technology. These theories, which are covered in the first two segments of the course, provide some insight into where society is going and what challenges have emerged along the way.  In the third segment of the course, we will look more closely at the role of individuals and everyday interaction in the genesis of social phenomena.  We will explore theories about what motivates individuals' social behavior, the role of rationality and emotion, how the micromechanics of interpersonal contact can shape larger society, and the subtle links between biological and social processes.  In the final segment of the course, we will explore complex webs that emerge through social actors' connections to each other, and how these network structures have been shaped by the various processes that were examined during the semester"
SOC 3310,Modern European Politics,3,Graded,Summer,,,GOVT 3323,(SBA-AS),,,"Introduction to politics and political systems in Western Europe.  Starts with a brief history of the consolidation of West European democracies before and after World War II. Discusses core theoretical concepts guiding the comparative analysis of political systems. The main part of the course consists of a discussion of the political cultures, parties, electoral systems, and current problems confronting the political systems of various countries focusing on Italy which is treated in depth. The course concludes with an analysis of the European Union (EU) as political system"
SPAN 1230,Continuing Spanish,4,Graded,"Fall, spring","SPAN 1120, SPAN 1220, or LPS 45-55, or SAT II 460-580",,,,,,"The goal of this low-intermediate course is to achieve a higher level of comprehension as well as to advance oral and written expression in a cultural context. Classes are in Spanish and the language is actively used in communicative and creative activities. Students engage in linguistic and literary analysis of texts to acquire new vocabulary, complete analytical exercises, and develop reading strategies. Students continue developing writing skills through composition, give oral presentations, and review grammatical structures independently with some clarification by the instructor as needed. After this course, students may take SPAN 2000, SPAN 2070, or SPAN 2090"
SPAN 2090,Intermediate Spanish I (Composition and Conversation),4,Graded,"Fall, spring, summer","SPAN 1230, or LPS 56-64, or SAT II 590-680, or CASE Q",,,,,,"This intermediate course develops accurate and idiomatic oral and written expression in a cultural context. Students achieve a higher level of syntactical and lexical competence through reading and discussing literary texts and viewing films. Particular emphasis is on writing and editing academic essays with peer/instructor feedback. Classes are in Spanish and the language is actively used in oral presentations and communicative, creative, and critical-thinking activities. Students review grammar structures on their own, with clarification and support of the instructor. After this course, students may take SPAN 2140, SPAN 2150, SPAN 2170, or SPAN 2190"
SPAN 2190,Intermediate Spanish II (Composition and Conversation),4,Graded,"Fall, spring","SPAN 2070, or SPAN 2090, or CASE Q+",,,,,,"This advanced-intermediate course is designed to prepare students for study abroad, entry into the major, and advanced-level courses. Students study stylistics, analyze and discuss texts, view films, and acquire advanced reading strategies. Continued emphasis is on writing and editing academic essays with peer and instructor feedback. Classes are in Spanish, and the language is actively used in oral presentations and communicative, creative, and critical-thinking activities. Students review grammar structures on their own, although the instructor may clarify as needed. The course is required for the major and may be taken concurrently with SPAN 2140, SPAN 2150, or SPAN 2170"
SPAN 2230,Perspectives on Spain,4,Stdnt Opt,Fall,,,,(LA-AS),,,"An introduction to Spain's history, plural cultures, and present-day society. Through a series of key literary works, films, and other visual representations we will explore such topics as the place of tradition, religion, and the family in modern Spain. Our focus will be on the transformation of Spain from an authoritarian state under General Franco's dictatorship (1939-1975) into a remarkably diverse and pluralistic nation in which linguistic, cultural, political, and gender differences have been consecrated in a very progressive legislation. This course satisfies the main requirement for the minor in Spanish, may be used as an elective for the major, and is crucial to those planning to study abroad in Spain in the near future"
SPAN 3110,Advanced Spanish Writing Workshop,4,Graded,"Fall, spring",SPAN 2190 or CASE Q++ or equivalent,,,,,"taken concurrently with SPAN 2140, SPAN 2150, or SPAN 2170","This course, which is required for the major, is designed to help the learner develop increased accuracy and sophistication in writing in Spanish for academic purposes and continued oral practice in Spanish. To this end, there will be ample writing and revising practice, with a focus on specific grammatical and lexical areas, customized to the needs of the students enrolled in the course"
STS 1451,"Body, Mind, and Health: Historical Perspectives for Future Professionals",3,Graded,Summer,,,,(CA-AS),(HB),,"A course in the social history of medicine that examines the ways in which medicine and its practitioners have impacted-and been impacted by-American social, political, cultural, and economic development. The course focuses on the changing nature of disease, the medical profession past and present as well as historical and contemporary issues in pubic health. Films on different diseases and medical issues are shown twice weekly in the afternoons and there are daily morning discussion sections with teaching assistants to talk about reading and writing assignments. Students are evaluated on written assignments, participation in lectures and discussion sections, and performance on an in-class final"
STS 2131,Science Fiction,4,Stdnt Opt,"Fall, summer",,,"COML 2035, ENGL 2035",(CA-AS),(GB),,"Science fiction, as Fredric Jameson put it, is ""the only kind of literature that can reach back and colonize reality."" Today more than ever, when science and technology have penetrated everyday life in ways that would have seemed impossible only a few decades ago, it has become apparent that science fiction is not merely a literary genre but a whole way of being, thinking, and acting in the modern world. The course explores classic and contemporary science fiction from Frankenstein to The Hunger Games alongside a rich array of fiction, films, and new media from Europe, Asia, Africa, and Latin America. Our discussions will position these works vis-à-vis seminal thinkers, ranging from Plato to Descartes and Donna Haraway to Paul Crutzen, who ask the same questions as science fiction does about ourselves, our world, and our future"
STS 2871,Evolution,3,Stdnt Opt,"Fall, summer",,,BIOEE 2070,(PBS),,for credit after BIOEE 1780,"Evolution is the central concept in biology. This course examines evolution as a science and places it in an historical context.  Lectures focus on descent with modification, the nature of natural  selection, the history of the earth, the information content of the fossil record, and processes responsible for diversification (speciation and extinction).  The science of evolutionary biology is presented in the context of a broader history of ideas in science.  The course also explores the importance of evolutionary thinking in the 21st century, including discussion of antibiotic and pesticide resistance, personalized genomics, climate change, and the conflict between creationists and evolutionists"
STSCI 2100,Introductory Statistics,4,GradeNoAud,"Fall, spring, summer",,,ILRST 2100,(MQR),,"Students may receive credit for only one course in the following group: AEM 2100, ENGRD 2700, HADM 2010, ILRST 2100, MATH 1710, PAM 2100, PAM 2101, PSYCH 3500, SOC 3010, STSCI 2100, STSCI 2150","Statistics is about understanding the world through data. We are surrounded by data, so there is a lot to understand. Covers data exploration and display, data gathering methods, probability, and statistical inference methods through contingency tables and linear regression. The emphasis is on thinking scientifically, understanding what is commonly done with data (and doing some of it for yourself), and laying a foundation for further study. Students learn to use statistical software and simulation tools to discover fundamental results. They use computers regularly; the test includes both multimedia materials and a software package. This course does not focus on data from any particular discipline, but will use real-world examples from a wide variety of disciplines and current events"
STSCI 3510,Introduction to Engineering Stochastic Processes I,4,Stdnt Opt,"Spring, summer",grade of C- or better in ORIE 3500 or equivalent,,"ORIE 3510, ORIE 5510",,,,"Uses basic concepts and techniques of random processes to construct models for a variety of problems of practical interest. Topics include the Poisson process, Markov chains, renewal theory, models for queuing, and reliability"
SYSEN 5960,Systems Engineering Design Project for Virtual Teams,1-8,Graded,"Fall, spring, summer","SYSEN 5100, SYSEN 5920, SYSEN 5940, and SYSEN 6910, or permission of instructor",,,,,,Systems engineering project for geographically dispersed teams
UNIV 3060,Summer Research Chemistry,0,Sat/Unsat,,,,,,,,No description available
UNIV 3063,"GK-12 ""Grass Roots""",0,Sat/Unsat,,,,,,,,No description available
UNIV 3064,Design Collaborations as Sociotechnical Systems,0,Sat/Unsat,,,,,,,,No description available
UNIV 3068,Molecular Biolory & Genetics REU,0,Sat/Unsat,,,,,,,,No description available
UNIV 3071,CIS/ENGR Computational Sustainability,0,Sat/Unsat,,,,,,,,No description available
UNIV 3074,Summer volunteer in Dr. Clark's lab,0,Sat/Unsat,,,,,,,,No description available
UNIV 3075,Academia do Brazil em Cornell (ABC),0,Sat/Unsat,,,,,,,,No description available
UNIV 3076,High Resolution Mapping of Recombination in Maize,0,Sat/Unsat,,,,,,,,No description available
UNIV 3081,Plant Biology Summer Research,0,Sat/Unsat,,,,,,,,No description available
UNIV 3082,Microbial Friends and Foes PL PA,0,Sat/Unsat,,,,,,,,No description available
UNIV 3083,Baker Summer Investigator Program,0,Sat/Unsat,,,,,,,,No description available
UNIV 3084,Baker Institute for Animal Health,0,Sat/Unsat,,,,,,,,No description available
UNIV 3085,RESESS,0,Sat/Unsat,,,,,,,,No description available
UNIV 3086,CS Research,0,Sat/Unsat,,,,,,,,No description available
UNIV 3087,Cornell Lab Accelerator-based Sciences and Education,0,Sat/Unsat,,,,,,,,No description available
UNIV 3103,UG Research,1-6,Sat/Unsat,,,,,,,,No description available
VETCS 1200,Conservation Medicine: A Veterinary Perspective,3,Graded,Summer,,,,,,,"Discover how veterinarians are helping to combat the global biodiversity crisis and - through lectures, labs, field trips, films, and guest speakers - explore such topics as conservation medicine, biological principles, field study techniques, and wildlife management. This program will introduce you to conservation practices, veterinary medicine, and biological principles as they relate to the health of our planet"
VETCS 1210,Veterinary Medicine: Equine Practice,3,Graded,Summer,,,,,,,"Designed to enable the students to understand the basic principles of horse husbandry and management, emphasizing anatomy, nutrition, preventive medicine, first-aid, common diseases, lameness, and farrier work. The materials are presented in lectures and labs with horses that invite direct student participation"
VIEN 1106,Winemaking Basics for Home Winemakers,3,Stdnt Opt,Summer,,,FDSC 1106,,,,"This distance learning course is an overview of wine production practices and the scientific principles behind them, assuming no previous coursework in enology. Topics include harvest decisions, prefermentation options, yeast inoculation procedures, malolactic conversion, adjustments and stabilization. Course is geared toward students interested in home winemaking, though principles apply to larger scale winemaking"
VISST 2360,Public Voice and Civic Gesture,1,Stdnt Opt,Summer,,,PMA 2270,,,,"Working with students from various performing and non-performing backgrounds, as well as different levels of technical proficiency. This course combines acting and movement techniques encouraging process-oriented work. Focusing on performance in civic spaces, the class works to examine the politics of status and the social role of bodily (including vocal) expression of both performer and audience.  Working within the specific context of urban public spaces, the class will question the function of monument and the character of urbanism in relation to individual bodies while understanding how these bodies combine to create a body politic. The class will consider traditional tools of political and social satire, including Commedia dellArte.  Fundamental in commedia is the exploration of status, the gradation of power and influence and role-playing. Students will create their own texts and movement as well as draw from other textual and visual sources. The class will conclude with a public performance"
VISST 3210,Ancient/Modern Corpo-Realities,4,Stdnt Opt,Summer,,,"ITAL 3270, PMA 3380",(LA-AS),(HB),,"Held in Rome, this history/theory/critisism course examines that modern city as it interfaces with its past, by analyzing corporeal/spatial epistemologies through the analyses of films that used Rome as a location, visiting those location sites that extend from the historic center to as far as the suburb EUR. Topics include examination of the ways in which class relates to social and public space and urban space as performance. Additional course work in film production, performance, and writing allows students to re-inscribe their spatial/corporeal experiences into an alternative exhibition space of the city street or the written page. In addition, each student will be required to produce formal textual documentation and full textual analyses of this process and final performance, installation, or text-based product"
VISST 4696,The Art Market,4,Graded,Summer,,,"AMST 4696, AMST 6696, ARTH 4696, ARTH 6696",(LA-AS),,,"This course will examine the history of the art market, from the 16th century to the present. We will study the production, sale and exchange of works of art as well as the patrons, artists and collectors who participate in this economic, social and political form of taste-making and aesthetic valuation. Students will learn about noted patrons of the arts, such as the Medici family in Renaissance Italy, our main focus will be on the creation of a global art market in the twentieth century. Using case studies, sample topics include: patterns of transportation, exchange and trade; the interaction of collectors, critics and curators; the spaces and contexts of display of contemporary collections; auction houses and commercial galleries; and fakes, forgeries, thefts and scandals. Special attention will be paid to considering the contemporary art market (post 1980) and the collecting, exchange and valuation of film, photography, painting, performance and installation art. Global markets for the exchange of art in Asia, Europe, Africa, North America and South America will be highlighted as well as the exhibitions of contemporary art such as the Art Basel, the Cairo Biennale and the Venice Biennale that fuel these markets"
VTBMS 1200,Veterinary Medicine: Science and Practice,3,Graded,Summer,,,,,,,"The course serves as an introduction to the science and practice of veterinary medicine. Aspects of the anatomy, physiology, pharmacology and several clinical specialties will provide insight into the knowledge behind veterinary medicine and other medical careers. Material will also offer insight into the diversity of career options available in this and related fields. Study will be at the level of introductory undergraduate course material"
VTMED 5600,Ambulatory and Production Medicine,2,Graded,"Fall, spring, summer",,,,,,,"Clinical service rotation in which students accompany ambulatory clinicians on farm and stable calls and learn the skills and procedures necessary for operation of a modern veterinary practice offering primary care to large-animal clients. Routine herd health visits are conducted for cattle, horses, sheep, goats, and swine. Reproductive evaluations (including pregnancy and fertility examinations), nutritional evaluation, and disease prevention are stressed. Herd health programs also include vaccinations, parasite control, mastitis prevention, and routine procedures. With appropriate herds, analysis of computerized performance data is conducted and discussed with the owner. In addition to assisting with routine scheduled work, students participate in diagnosis and medical or surgical treatment of ill or injured animals. This includes rotating assignments for night and weekend duty"
VTMED 5601,Community Practice Service: Medicine,2,Graded,"Fall, spring, summer",,,,,,,"Structured to provide supervised clinical experience on a primary care service. The course is conducted in the Companion Animal Hospital of the Cornell University Hospital for Animals. Students interact directly with clients presenting their pets for primary medical care and elective surgeries. During the course, students also participate in surgical procedures on the Shelter Outreach Service. Under the supervision of the clinical faculty and staff, the students are expected to formulate and carry out plans for the diagnostic evaluation and medical management of their patients. Students are also expected to follow up on the outcome of their management decisions. In addition to attending a parasitology laboratory and several service rounds, students will have an occasional opportunity to observe appointments handled by the Medical Genetics, Dentistry, Behavior, and Theriogenology Services"
VTMED 5602,Small Animal Medicine,2,Graded,"Fall, spring, summer",,,,,,,"Structured to provide supervised clinical experience in the practice of companion small-animal medicine. The course is conducted in the Companion Animal Hospital of the Cornell University Hospital for Animals. Students interact directly with clients presenting their pets for primary or referral medical care. Under the supervision of the clinical faculty and staff, the students are expected to formulate and carry out plans for the diagnostic evaluation and medical management of these patients"
VTMED 5603,Small Animal Soft Tissue Surgery Service,2,Graded,"Fall, spring, summer",,,,,,,"Clinical service rotation that exposes the student to the practice of surgery under hospital conditions. Students participate in office hours, diagnostic techniques, planning of therapy, and daily care of dogs and cats under the direction of a faculty veterinarian. Students assist experienced surgeons in the operating room. Client communications and the basics of efficient practice are emphasized"
VTMED 5604,Large-Animal Medicine Service,2,Graded,"Fall, spring, summer",,,,,,,"Students assigned to this service assist the faculty, technicians, and residents of the Large-Animal Medicine Service in the diagnosis and care of patients. The goal of this course is for students to acquire knowledge and skills in history taking, physical examination, selection and completion of appropriate ancillary tests, diagnosis, treatment, and patient care. Daily rounds and discussions are used to monitor patient progress and further educate students. If time allows, sit-down rounds to discuss medical disorders are provided"
VTMED 5605,Large Animal Surgery I,2,Graded,"Fall, spring, summer",,,,,,,"Clinical rotation structured to provide supervised clinical experience in the practice of large-animal surgery. Under the direction of faculty and house staff, students participate in the diagnosis, surgical treatment, and care of patients presented to the Equine and Farm Animal Hospital. Training through patient care is supplemented by formal rounds and didactic instruction"
VTMED 5606,Anesthesiology Service,2,Graded,"Fall, spring, summer",,,,,,,"Designed to provide clinical experience in the use of anesthetics in small companion animals, horses, and some farm animals.  Students participate in selecting suitable anesthetic techniques for patients in the Cornell University Hospital for Animals and then implement those techniques under the supervision of faculty and residents.  The goal is for students to learn the skills and thought processes necessary to perform safe anesthesia in a modern veterinary practice"
VTMED 5607,Dermatology Service,2,Graded,"Fall, spring, summer",,,,,,,"During this clinical rotation, students participate in the diagnosis and management of skin disorders in small and large animals. Patients are examined by appointment and through consultation with other hospital services"
VTMED 5608,Ophthalmology Service,2,Graded,"Fall, winter, spring, summer",,,,,,,"Combines clinical experience with beginning skills in diagnostic ophthalmology. Students learn how to apply the ophthalmic diagnostic tests. A competent ocular examination is the goal of this rotation. Confidence in using direct and indirect ophthalmoscopes, slit lamps, tonometers, conjunctival cytology, and surgery comes with the practice provided by this rotation. This rotation provides surgical experience and consultations. A high percentage of the consultations are referral cases that usually challenge the service. Adequate routine case material is presented to prepare most students for practice"
VTMED 5609,Pathology Service,2,Graded,"Fall, spring, summer",,,,,,,"The pathology rotation strives to integrate gross pathology with other diagnostic modalities. Students will work in groups of three to six for the two-week rotation performing necropsies on mammals, birds, exotic species, and laboratory animals under the guidance of pathology faculty and residents. Students will prepare written reports of the necropsies performed and discuss the findings at daily morning rounds. Students will also be instructed by faculty of the Animal Health Diagnostic Center with expertise in ancillary diagnostic techniques. Students will be expected to learn to use diagnostic testing regimens as integral parts of comprehensive diagnostic and therapeutic plans. Instruction will consist primarily of the discussion of clinical cases with emphasis on laboratory diagnostics. Students will be expected to lead and participate in these discussions and will be evaluated on their ability to do so"
VTMED 5610,Radiology Service,2,Graded,"Fall, spring, summer",,,,,,,"Two-week clinical experience in the imaging section of the Cornell University Hospital for Animals. Students use radiographic, ultrasonographic, CT, MRI, and nuclear medicine imaging techniques to evaluate animal patients under treatment in the Cornell University Hospital for Animals. Students obtain and interpret radiographic and ultrasonographic studies with guidance from radiology faculty, residents, and technical staff. On-line teaching materials are used to familiarize students with radiographic and cross-sectional imaging examples of common diseases of large- and small-animal species. Small-group discussions are included to present and discuss the teaching files and current cases, in addition to the safe use of X-ray-producing equipment"
VTMED 5611,Small Animal Clinical Emergency and Critical Care Medicine,2,GradeNoAud,"Fall, spring, summer",,,,,,,"Management of both emergent and critical cases represents a significant component of the practice of veterinary medicine. The focus of this clinical rotation will be the development of a knowledge base and a comprehensive set of skills necessary for a veterinarian to perform adequately in these areas, within a structured format. These skills include the appropriate evaluation (triage) and stabilization of emergency patients, the management of postoperative and other critical patients, and sensitive and effective client communication. Participants access relevant information fromvarious sources related to emergency and critical care medicine and understand and apply these principles to clinical cases. Students will participate in the management of incoming emergency cases as well as have primary patient care responsibilities in both intensive care and intermediate care units. Students will work closely with interns, residents, technicians and faculty on the Emergency & Critical Care Service to become familiar with technical and nursing procedures as well as to develop clinical skills and a systematic approach to clinical cases"
