Code,Title,Credits,Grading,Semesters Offered,Prerequisites,Corequisites,Crosslisted,Distribution Category,Breadth Requirement,Forbidden Overlap,Description
GOVT 3052,Intro to the Structure & System of American Law,3,Stdnt Opt,Summer,,,,(KCM-AS),,,"Students will receive an introduction to the American legal system including judicial and legislative processes and their roles within the structure of the law. Topics covered include constitutional law, criminal law, contract law, and tort law"
GOVT 3071,Introduction to Public Policy,4,Graded,Summer,,,,(SBA-AS),,,"Public policy is shaped by many forces. This course will enhance your ability to understand those forces and the policies that they produce. It will provide you with tools for thinking about, assessing, and evaluating those policies. And it will introduce you to the substantive core of several major issues in America today. The course will have three segments. In the first, we will examine the relevant institutions, interests, and ideologies which operate in the policy arena and the debates about the impact of these forces which engage students of the policy process. In the second, we will consider two different lenses through which we might peer to evaluate policies. In the third, we will discuss the main lines of debate in contemporary American politics concerning four substantive issues: crime and punishment, education, the economy and foreign trade, and foreign policy. The course will meet four days a week for one hour. Based on assigned readings, the class sessions will mix lectures, discussions, group activities, and guest speakers"
GOVT 3128,America's Changing Faces,2,Stdnt Opt,Summer,,,AMST 3128,,,,"A new generation of leaders has emerged in America's political, economic, educational, and cultural institutions. Those leaders employ and explore in their work modern communications technologies such as the Internet. Thereby, they are changing both what is done and how things are done in the respective life spheres. This course explores the resulting changes in the nature of American life and asks questions about the interactions among the different realms of life"
GOVT 3141,Prisons,4,Stdnt Opt,"Fall, winter, summer",,,AMST 3141,(SBA-AS),,,"The United States stands alone among Western, industrialized countries with its persistent, high rates of incarceration, long sentences, and continued use of the death penalty. This ""American exceptionalism"" -- the turn to mass incarceration -- has been fostered by the use of sharply-delineated categories that define vast numbers of people as outlaws and others as law-abiding. Our purpose in this course is to understand how social and political actors have utitlized ideas that have deep roots in American political thought (ideas about rights, race, and responsibility) in ways that have now come to define large groups of the population as 'carcerable.'"
GOVT 3150,The American Legal System,4,Stdnt Opt,Summer,,,,(CA-AS),,,"This course offers a comprehensive introduction to the American legal system, its roots in natural and common law, the purposes/values it serves (e.g., resolution of private grievances; punishment of offenses against the polity and individuals; preservation, development, and limitation of individual and group rights; and facilitation of commerce and private agreements), and the roles of the judiciary, legislature, and private parties. The course is taught using the Socratic method employed at most US law schools and introduces students to fundamental concepts and techniques used by attorneys and courts in analyzing cases, interpreting statutes, and determining disputes. As in law school, students are expected to read assigned materials before each class meeting and to participate actively in class discussions. For additional information, see the Summer Session website.   "
GOVT 3323,Modern European Politics,3,Graded,Summer,,,SOC 3310,(SBA-AS),,,"Introduction to politics and political systems in Western Europe.  Starts with a brief history of the consolidation of West European democracies before and after World War II. Discusses core theoretical concepts guiding the comparative analysis of political systems. The main part of the course consists of a discussion of the political cultures, parties, electoral systems, and current problems confronting the political systems of various countries focusing on Italy which is treated in depth. The course concludes with an analysis of the European Union (EU) as political system"
GRAD 9006,Graduate Summer Research,0,S/U NoAud,,,,,,,,No description available
HADM 1101,Hotel Operations Management: Tactics for Profitability,3,GradeNoAud,Summer,,,,,,,"In this program you will develop your business, management, and leadership skills while refining their computer, communication, and analytical skills. You will have the opportunity to explore the hospitality industry at the world-renowned School of Hotel Administration"
HADM 3135,Conversations with Entrepreneurs,2,S/U NoAud,"Fall, winter, spring. (Weeks 8-14)",,,HADM 6135,,,,"This course is intended to expose students to the entrepreneurial journey. Weekly guest speakers interact with students to create a picture of what it is to be an entrepreneur. Established entrepreneurs to entrepreneurs just starting their own businesses share their stories to highlight the challenges and benefits of entrepreneurship. The course illustrates the value of the entrepreneurial mind and entrepreneurial thinking to professional career development for both students who plan to pursue a career in corporations or start their own ventures. The objectives of the course are achieved through attendance at lectures, reflective assignments on entrepreneurial speaker presentations, entrepreneurial career planning assignments, and an entrepreneurial journey project"
HADM 4180,Technology for Bootstrapped Entrepreneurship,3,GradeNoAud,"Winter, spring",,,HADM 6180,,,,"This course provides an overview of how to identify, evaluate, and design technology to enhance service delivery in bootstrapped entrepreneurial ventures. The course prepares students who have entrepreneurial intentions in a bootstrapped venture, whether for-profit or non-profit, to view contemporary issues in service delivery through the prism of entrepreneurial theory and practice. The class starts out using BMFiddle as a tool to model a business idea in the cloud for collaborative feedback.  As the semester progresses, this model becomes the basis for the final project, the creation of a strategic technology plan that integrates many types of cloud-based technology vendors to maximize the execution and growth of a start-up entity.  This objective is achieved through attendance at lectures and hands-on labs utilizing a mix of instructional methods including cooperative learning activities, hospitality case studies, alumni interview case development, reflective logs, group and individual pitch assignments, and project-based written assignments"
HADM 6135,Conversations with Entrepreneurs,2,S/U NoAud,"Fall, winter, spring. (Weeks 8-14)",,,HADM 3135,,,,"This course is intended to expose students to the entrepreneurial journey. Weekly guest speakers interact with students to create a picture of what it is to be an entrepreneur. Established entrepreneurs to entrepreneurs just starting their own businesses share their stories to highlight the challenges and benefits of entrepreneurship. The course illustrates the value of the entrepreneurial mind and entrepreneurial thinking to professional career development for both students who plan to pursue a career in corporations or start their own ventures. The objectives of the course are achieved through attendance at lectures, reflective assignments on entrepreneurial speaker presentations, entrepreneurial career planning assignments, and an entrepreneurial journey project"
HADM 6180,Technology for Bootstrapped Entrepreneurship,3,GradeNoAud,"Winter, spring",,,HADM 4180,,,,"This course provides an overview of how to identify, evaluate, and design technology to enhance service delivery in bootstrapped entrepreneurial ventures. The course prepares students who have entrepreneurial intentions in a bootstrapped venture, whether for-profit or non-profit, to view contemporary issues in service delivery through the prism of entrepreneurial theory and practice. The class starts out using BMFiddle as a tool to model a business idea in the cloud for collaborative feedback.  As the semester progresses, this model becomes the basis for the final project, the creation of a strategic technology plan that integrates many types of cloud-based technology vendors to maximize the execution and growth of a start-up entity.  This objective is achieved through attendance at lectures and hands-on labs utilizing a mix of instructional methods including cooperative learning activities, hospitality case studies, alumni interview case development, reflective logs, group and individual pitch assignments, and project-based written assignments"
HADM 7030,Operations Management,3,GradeNoAud,Summer,,,,,,,"This course is designed to address the key operations and logistical issues that have strategic as well as tactical implications for the hospitality and related service-sector companies.  In this course we will address how a well-defined operations strategy can lead to a set of coherent managerial decisions and improve corporate performance.  Several world-class firms have demonstrated that efficient operations management can become a potent competitive weapon in even the toughest business environments.  We will examine both quantitative and qualitative operational techniques and principles used by ""world-class"" organizations from the United States and abroad"
HADM 7230,Corporate Finance,3,GradeNoAud,Summer,,,,,,,"Builds on the prerequisite courses of financial accounting and financial reporting. Topics include applications of discounting techniques, evaluation of capital expenditures, estimation of cost of capital, bond and stock valuation, portfolio theory, asset-pricing models, and capital-structure decisions. The course emphasizes valuation skills as a means to bring together the cost of capital, financing, and operating issues faced by a firm. Students come to understand the financial impact of managerial decisions, know how to differentiate decisions that increase the value of a firm, and know how to properly evaluate investment and financing decisions. They also learn standard techniques of financial analysis, such as discounted cash-flow valuation, capital budgeting, risk analysis, and estimation of the cost of debt and equity"
HADM 7240,Managerial Accounting,3,GradeNoAud,Summer,,,,,,,"This introduction to managerial accounting, which is the use of accounting information for decision making and control, covers cost behavior, cost classification, cost-volume-profit analysis, product costing, budgeting, variance analysis, cost estimation, cost allocations, customer-profitability analysis, managerial control systems, and performance measurement"
HADM 7430,Marketing Management for Services,3,GradeNoAud,Summer,,,,,,,"Covers the fundamental concepts of marketing management and the techniques, analyses, and frameworks for solving marketing management problems. Students explore theories and conceptual frameworks that draw on customer, competitor, and core-capability analyses in marketing planning and implementation. Students develop decision-making capabilities in product/service development, pricing, advertising and promotions"
HADM 7970,Leadership Development Program (LDP),1,S/U NoAud,Summer,,,,,,,"A group of senior executives from the hospitality industry visit the campus to evaluate students as individuals and as part of a team. They assess how well the students are able to lead, take direction, work with others, present ideas, and listen to other ideas. At the end of the class, one or more of the industry ""coaches"" meet with students individually, and in teams, to evaluate performance. This centerpiece of the orientation process is designed to outline some of the personal and career goals students will want to work toward in the coming year"
HD 1150,Human Development: Infancy and Childhood,3,Stdnt Opt,Fall or summer,,,,,,,"Introduces students to the basic concepts, theories, and research in human development as they explain prenatal development and development in infancy and childhood, including physical, cognitive, and social/emotional development. The focus is on individual development from an interdisciplinary perspective with an emphasis on psychological development, but also drawing from the fields of sociology, history, biology, anthropology, neuroscience, and education"
HD 2600,Introduction to Personality,3,Stdnt Opt,Fall,,,PSYCH 2750,,,,"A shared assumption among personality psychologists is that each person possesses a personality--i.e., characteristic ways of thinking, feeling, and behaving--that uniquely distinguishes him or her from other people. Each individual's personality is the culmination of his or her genetic makeup, biology, early life experiences, learning and culture. In this undergraduate-level course, we will review the major theories and research paradigms (e.g., trait, biological, cognitive) of modern-day personality psychology. The course will emphasize contemporary research, theory, and methodology, as well as provide a review of historical accounts that have significantly contributed to current conceptualizations"
HD 4200,Risk and Rational Decision Making,4,Stdnt Opt,,,,,,,,No description available
HE 1006,Reading Lab,1,Sat/Unsat,Summer,,,,,,,"This course will better prepare college students to learn how to engage with reading differently in the context of their courses and ultimately in their professions beyond their college careers. This course focuses on developing skills and knowledge to read more efficiently, effectively, critically and evaluatively"
HE 1105,Strategies for College Success: Critical Thinking and Effective Learning,2,Stdnt Opt,Summer,,,,,,,"Designed to provide students with the academic skills necessary for a successful and fulfilling college career. Examines theory and research associated with a wide range of reading, thinking and learning skills. Emphasis is placed on developing and applying analytical and evaluative abilities. The format of the course includes lectures, discussion sections, and individual meetings"
HE 1110,College Achievement Seminar,2,Stdnt Opt,Summer. (Six-week session),,,,,,,"Improves the study and learning skills of incoming freshmen. Emphasis is placed on acquisition of skills necessary to achieve academic success. Topics include time management, note taking, mapping, textbook comprehension, exam preparation, and exam strategies. The application of theory to the demands of Cornell course work is stressed"
HE 4060,Fieldwork in Diversity and Professional Practice: The Culture of Medicine and Public Health,3,Graded,Summer. (Eight-week session),,,,,,,"This course is part of the Urban Semester Program in New York City. Students learn through a cycle of experience and reflection. Over the course of eight weeks, students learn how to implement experience-based learning techniques and perspectives to enhance their competencies as initiates of professional practice. Students spend four days each week in an internship of their own choosing. One day each week, students have discussions with professionals who represent different aspects of the New York City economy. This exposure enables students to explore a variety of professional perspectives and practices. Students participate in reflections seminars with the director of the program to explore student internship experiences and learning"
HE 4080,Fieldwork in Diversity and Professional Practice: Community and Public Service,3,Graded,Summer. (Eight-week session),,,,,,,"This course is part of the Urban Semester Program in New York City. Students learn through a cycle of experience and reflection. Over the course of eight weeks, students learn how to implement experience-based learning techniques and perspectives to enhance their competencies as initiates of professional practice. Students spend four days each week in an internship of their own choosing. One day each week, students have discussions with professionals who represent different aspects of the New York City economy. This exposure enables students to explore a variety of professional perspectives and practices. Students participate in reflections seminars with the director of the program to explore student internship experiences and learning"
HE 4090,"Fieldwork in Diversity and Professional Practice: Finance, Business, Law and Other Settings",3,Graded,Summer. (Eight-week session),,,,,,,"This course is part of the Urban Semester Program in New York City. Students learn through a cycle of experience and reflection. Over the course of eight weeks, students learn how to implement experience-based learning techniques and perspectives to enhance their competencies as initiates of professional practice. Students spend four days each week in an internship of their own choosing. One day each week, students have discussions with professionals who represent different aspects of the New York City economy. This exposure enables students to explore a variety of professional perspectives and practices. Students participate in reflections seminars with the director of the program to explore student internship experiences and learning"
HE 6070,Special Studies,1-9,Stdnt Opt,,,,,,,,No description available
HIST 1510,Introduction to Western Civilization I,4,Stdnt Opt,"Fall, summer",,,,(HA-AS),(HB),,"The West and its relations with the rest of the world are central topics today, but just what is the West and what is its history? This course surveys the history of the West from remote antiquity to the 16th century. We will consider developments in technology, economy, politics, religious institutions and faiths, cultural media and social ideals. Together, these themes add up to civilization in the west. We will acquaint ourselves with these dimensions of the past while seeking to acquire the basic skills professional historians use to learn about this past"
HIST 1511,"The Making of Modern Europe, from 1500 to the Present",4,Stdnt Opt,Spring,,,,(HA-AS),(HB),,"How do we make sense of the recent controversies around Islam and the ""veil"" in France, the reform of the Welfare State in Great-Britain, the anti-globalization protests in Davos, the rise of demagogic anti-immigrant parties from the Netherlands to Italy, or the fact that Swedes get more than thirty paid days off per year? This course seeks to answer these questions by exploring the history of modern Europe. Among other themes, we will discuss the Protestant Reformation, the rise of absolutism, the Enlightenment, the French Revolution, industrialism, colonialism, the Russian Revolution, the two world wars, decolonization and immigration, May '68, and the construction of the European Union. In conjunction, we will examine how modern ideologies (liberalism, Marxism, imperialism, conservatism, fascism, totalitarianism) were developed and challenged. Through a wide array of historical documents (fiction, letters, philosophy, treatises, manifestos, films, and art), we will consider why ""old Europe"" is still relevant for us today"
HIST 1571,"American Military History from the World Ward to 9/11, Iraq and Afghanistan, 1900-2014",4,Graded,"Spring, summer",,,,(HA-AS),,,"America is finishing up two wars, one in Iraq and one in Afghanistan. They have been the longest wars in American history and have ended amid much ambivalence about the US engagement in each place and the results. They are part of a series of wars that America has fought as a global power, with a global reach, sending its forces thousands of miles from home. That global reach is not new, and goes back all the way to 1898 and the Spanish-American War. This course will look at the American military experience from our first tentative steps onto the global stage in 1898, to the earth-spanning conflicts of World War I and II, to the nuclear tension of Cold War conflicts, and finish with the current Long War against terrorism, and the conflicts in Iraq and Afghanistan"
HIST 1880,American Constitutional History,3,Stdnt Opt,,,,,,,,No description available
HIST 2591,A Global Approach to Modern Chinese History,3,Stdnt Opt,Summer,,,,(HA-AS),(GB),,"This course surveys modern Chinese history from a global perspective starting from the 19th century to the dawn of the 21st century. It is a lecture and discussion course that aims to help the students develop a better understanding of the major events that have, for better or worse, shaped China and made it what it is today. The key themes of the course include: Chinese response to the demands of Western powers, foreign images of China, the Opium Wars, the rise of a new order, the fragmentation and reform of the Qing Empire, the rise and fall of the nationalist government, the rise of communism and the People's Republic, the challenge of Deng's reforms and China's impact on the world"
HIST 2749,"Mughal India and the Early Modern World, c. 1500-1800",4,Stdnt Opt,,,,ASIAN 2274,,,,No description available
HORT 4990,Undergraduate Research,1-6,Stdnt Opt,Fall or spring,,,,,,,Undergraduate research projects in horticultural sciences
HORT 6970,Graduate Individual Study in Horticulture,1-6,Stdnt Opt,Fall or spring,,,,,,,Graduate individual study in horticultural sciences under the direction of one or more faculty members
ILRHR 2600,Human Resource Management,3,GradeNoAud,"Fall, spring, summer",,,,,,,"Intended to introduce students to the field of human resource management (HRM). Students learn theories and applications involved in effectively managing people in organizations. In addition, this course covers current topics in HRM that have resulted from environmental and organizational challenges (e.g., technology, globalization, legislation, restructuring, work/life balance, changing labor markets). Emphasis is placed on developing relevant problem-solving and critical-thinking skills, as the basic concepts of HRM and the skills developed in this course are applicable to all types of organizations and jobs in which students will eventually work"
ILRHR 2660,Essential Desktop Applications,2,GradeNoAud,"Fall, spring, summer",,,,,,,"Provides skills in the use of personal computers that run the Windows operating system. Covers the basics and time-saving techniques for Windows, and Microsoft Excel, Access, and PowerPoint. Emphasizes hands-on experience and development of PC-based solutions by using examples that address human resource and other practical real-world issues. The skills developed in this course are useful prerequisites for several elective courses in human resource management and essential in the 21st-century workplace"
ILRHR 7990,Directed Studies,1-9,GradeNoAud,"Fall, spring",,,,,,,For individual research conducted under the direction of a member of the faculty
ILRIC 4360,Global Comparative Disability Policy,4,GradeNoAud,"Fall, winter, summer",,,,,,,"Globalization is having an increasingly significant impact on international disability policy. This course will provide students an introduction to the UN Convention on the Rights of Persons with Disabilities, and a more in-depth comparative policy analysis of current and emerging disability and employment policy in specific parts of the world (e.g., the United States, South East Asia, Russia, South America, New Zealand, India, South Africa and Europe). Students will identify and discuss current events shaping international disability policy; conduct personal interviews of key informants to obtain firsthand knowledge of the experience of disability; and, participate in team-based classroom debates"
ILRLE 2400,Economics of Wages and Employment,3,GradeNoAud,"Fall, spring, summer",ECON 1110-ECON 1120 or permission of instructor; ILR students may substitute ILRLE 4400 if they have calculus,,,,,,"Applies the theory and elementary tools of economics to the characteristics and problems of the labor market. Considers both the demand (employer) and supply (employee) sides of the market to gain a deeper understanding of the effects of various government programs and private decisions targeted at the labor market. Topics include employment demand, basic compensation determination, education and training, benefits and the structure of compensation, labor-force participation and its relation to household production, occupational choice, migration, labor-market discrimination, and the effects of unions"
ILRLR 1100,Introduction to U.S. Labor History,3,GradeNoAud,"Fall, spring, summer",,,,,,,"Introductory survey covering the major changes in the nature of work, the workforce, and the institutions involved in industrial relations from the late 19th century to the present"
ILRLR 2300,Argumentation and Debate,3,GradeNoAud,Fall,,,,,,,"Students learn the principles of argumentation and debate. Topics emphasize Internet database research, synthesis of collected data, policy analysis of evidentiary quality, refutation of counter claims, identification of logical fallacies, risk evaluation, framing of issues, and coherent storytelling. Prepares students to work with a great range of opinion and evidence. Emphasizes different viewpoints, including those of different cultures. Assumptions are interrogated"
