Code,Title,Credits,Grading,Semesters Offered,Prerequisites,Corequisites,Crosslisted,Distribution Category,Breadth Requirement,Forbidden Overlap,Description
NBA 5841,Global Business Strategy,3,Opt NoAud,Winter,,,AEM 4940,,,,"In an increasingly globalized and interconnected world, more and more companies are going abroad to pursue their major business objectives. How can they take advantage of the global marketplace and create economic value through their multimarket activities? This course provides the evidence, analytical concepts and models for understanding company performance in a global world. The ultimate goal of the course is to help you prepare for global leadership in the early 21st century by understanding the analytical frameworks on strategy formulation and implementation in an international context. Topics include identification and assessment of the cultural, economic, political and legal forces that shape the international economic environment; the principles of global competition; motivations and models for international expansion; gains from and costs of trade and foreign direct investment; the pros and cons of forming global strategic alliances; and the principles of multinational strategy, among others. Through a series of concrete case discussions, the course further aims to help you develop practical skills in applying the tools of global strategic analysis in concrete business situations"
NS 1150,"Nutrition, Health, and Society",3,Stdnt Opt,"Fall, winter, summer",,,,,,,"Discusses the facts and fallacies concerning the role that nutrition, exercise, and other health behaviors play in preventing disease, maintaining good health, and maximizing athletic performance. Emphasis is on understanding the biological mechanisms through which good nutrition and regular exercise affect psychological and physical health"
ORIE 3150,Financial and Managerial Accounting,4,Graded,"Fall, winter, summer",,,,,,,"Covers principles of accounting, financial reports, financial-transactions analysis, financial-statement analysis, budgeting, job order and process-cost systems, standard costing and variance analysis, and economic analysis of short-term decisions"
PAM 4000,Directed Readings,1-15,Stdnt Opt,"Fall, spring",,,,,,,For study that predominantly involves library research and independent reading
PAM 4020,Supervised Fieldwork,1-15,Stdnt Opt,"Fall, spring",,,,,,,"For study that involves both responsible participation in a community setting and reflection on that experience through discussion, reading, and writing. Academic credit is awarded for this integration of theory and practice"
PSYCH 2750,Introduction to Personality,3,Stdnt Opt,Fall,,,HD 2600,(SBA-AS),,,"A shared assumption among personality psychologists is that each person possesses a personality--i.e., characteristic ways of thinking, feeling, and behaving--that uniquely distinguishes him or her from other people. Each individual's personality is the culmination of his or her genetic makeup, biology, early life experiences, learning and culture. In this undergraduate-level course, we will review the major theories and research paradigms (e.g., trait, biological, cognitive) of modern-day personality psychology. The course will emphasize contemporary research, theory, and methodology, as well as provide a review of historical accounts that have significantly contributed to current conceptualizations"
PSYCH 4700,Undergraduate Research in Psychology,1-6,Stdnt Opt,Fall or spring,,,,,,,"Practice in planning, conducting, and reporting independent laboratory, field, and/or library research"
SOC 1101,Introduction to Sociology,3,Stdnt Opt,"Fall, spring, summer",,,,(SBA-AS),,Students may not receive credit for both SOC 1101 and DSOC 1101,"This course introduces classical and contemporary sociological perspectives.  We will begin by considering (mainly classical) perspectives which focus on macro-level features of society (e.g., population, the economy) and the sweeping changes that have occurred within them over the past couple of centuries.  Particular attention will be paid to changes in social cohesion, the division of labor, the spatial organization of society, and technology. These theories, which are covered in the first two segments of the course, provide some insight into where society is going and what challenges have emerged along the way.  In the third segment of the course, we will look more closely at the role of individuals and everyday interaction in the genesis of social phenomena.  We will explore theories about what motivates individuals' social behavior, the role of rationality and emotion, how the micromechanics of interpersonal contact can shape larger society, and the subtle links between biological and social processes.  In the final segment of the course, we will explore complex webs that emerge through social actors' connections to each other, and how these network structures have been shaped by the various processes that were examined during the semester"
STSCI 2100,Introductory Statistics,4,GradeNoAud,"Fall, spring, summer",,,ILRST 2100,(MQR),,"Students may receive credit for only one course in the following group: AEM 2100, ENGRD 2700, HADM 2010, ILRST 2100, MATH 1710, PAM 2100, PAM 2101, PSYCH 3500, SOC 3010, STSCI 2100, STSCI 2150","Statistics is about understanding the world through data. We are surrounded by data, so there is a lot to understand. Covers data exploration and display, data gathering methods, probability, and statistical inference methods through contingency tables and linear regression. The emphasis is on thinking scientifically, understanding what is commonly done with data (and doing some of it for yourself), and laying a foundation for further study. Students learn to use statistical software and simulation tools to discover fundamental results. They use computers regularly; the test includes both multimedia materials and a software package. This course does not focus on data from any particular discipline, but will use real-world examples from a wide variety of disciplines and current events"
SYSEN 5700,Special Topics in Systems Engineering,1-6,Graded,,,,,,,,Supervised study by individuals or small groups of one or more specialized topics not covered in regular courses
VISST 4696,The Art Market,4,Graded,Summer,,,"AMST 4696, ARTH 4696",(LA-AS),,,"This course will examine the history of the art market, from the 16th century to the present. We will study the production, sale and exchange of works of art as well as the patrons, artists and collectors who participate in this economic, social and political form of taste-making and aesthetic valuation. Students will learn about noted patrons of the arts, such as the Medici family in Renaissance Italy, our main focus will be on the creation of a global art market in the twentieth century. Using case studies, sample topics include: patterns of transportation, exchange and trade; the interaction of collectors, critics and curators; the spaces and contexts of display of contemporary collections; auction houses and commercial galleries; and fakes, forgeries, thefts and scandals. Special attention will be paid to considering the contemporary art market (post 1980) and the collecting, exchange and valuation of film, photography, painting, performance and installation art. Global markets for the exchange of art in Asia, Europe, Africa, North America and South America will be highlighted as well as the exhibitions of contemporary art such as the Art Basel, the Cairo Biennale and the Venice Biennale that fuel these markets"